{
	"$schema": "http://json-schema.org/draft-07/schema#",
	"title": "Alfred Intent Schema",
	"type": "object",
	"required": ["intent", "display_name", "doctype", "fields"],
	"additionalProperties": false,
	"properties": {
		"intent": {"type": "string", "pattern": "^[a-z][a-z0-9_]*$"},
		"display_name": {"type": "string", "minLength": 1},
		"doctype": {"type": "string", "minLength": 1},
		"fields": {
			"type": "array",
			"minItems": 1,
			"items": {
				"type": "object",
				"required": ["key", "label", "type"],
				"additionalProperties": false,
				"properties": {
					"key": {"type": "string", "pattern": "^[a-z][a-z0-9_]*$"},
					"label": {"type": "string", "minLength": 1},
					"type": {"enum": ["data", "check", "select", "link", "table", "int", "text"]},
					"link_doctype": {"type": "string"},
					"options": {"type": "array", "items": {"type": "string"}},
					"required": {"type": "boolean"},
					"default": {},
					"rationale": {"type": "string", "minLength": 1}
				},
				"allOf": [
					{"if": {"properties": {"type": {"const": "select"}}}, "then": {"required": ["options"]}},
					{"if": {"properties": {"type": {"const": "link"}}}, "then": {"required": ["link_doctype"]}},
					{"if": {"not": {"properties": {"required": {"const": true}}}}, "then": {"required": ["default", "rationale"]}}
				]
			}
		}
	}
}
