{
	"intent": "update_print_settings",
	"display_name": "Update Print Settings (site-wide singleton)",
	"doctype": "Print Settings",
	"fields": [
		{
			"key": "pdf_generator",
			"label": "PDF generator",
			"type": "select",
			"options": ["wkhtmltopdf", "chrome"],
			"default": "wkhtmltopdf",
			"rationale": "wkhtmltopdf is the Frappe default and the most-tested path; reliable for classic Jinja print formats. chrome uses headless Chromium and renders modern CSS (flexbox / grid / web fonts) better, but requires a heavier runtime dependency and is measurably slower per render. Switch to chrome only when a specific print format needs modern CSS."
		},
		{
			"key": "with_letterhead",
			"label": "Include letterhead by default",
			"type": "check",
			"default": 1,
			"rationale": "Controls whether Print Formats wrap in the default Letter Head automatically. Default 1. Individual Print Formats can override via their own letter_head field."
		},
		{
			"key": "print_style",
			"label": "Default print style",
			"type": "link",
			"link_doctype": "Print Style",
			"default": "",
			"rationale": "Optional. Names a Print Style (a CSS bundle) applied site-wide. Empty uses Frappe's default style."
		},
		{
			"key": "send_print_as_pdf",
			"label": "Send print as PDF attachment",
			"type": "check",
			"default": 1,
			"rationale": "When 1 (default), print-sharing actions (email with print) attach a PDF rather than inlining the HTML. Rendering the PDF is slower; keep on unless the use case is purely HTML email."
		},
		{
			"key": "allow_print_for_draft",
			"label": "Allow printing draft documents",
			"type": "check",
			"default": 1,
			"rationale": "Default 1. When 0, draft (docstatus=0) documents cannot be printed - enforces 'only submitted docs print' discipline for audit-sensitive workflows."
		},
		{
			"key": "allow_print_for_cancelled",
			"label": "Allow printing cancelled documents",
			"type": "check",
			"default": 0,
			"rationale": "Default 0. Cancelled (docstatus=2) docs usually shouldn't print to avoid contractual confusion. Set 1 when audit trails require printed cancelled copies."
		},
		{
			"key": "repeat_header_footer",
			"label": "Repeat letterhead header/footer on every page",
			"type": "check",
			"default": 1,
			"rationale": "When 1 (default), the Letter Head header and footer repeat on every PDF page. When 0, they appear only on the first and last pages respectively. 0 produces cleaner multi-page reports."
		},
		{
			"key": "raw_printing",
			"label": "Enable raw printing (network printers)",
			"type": "check",
			"default": 0,
			"rationale": "When 1, enables raw-command print formats (ESC/POS, ZPL) via a configured print_server. Default 0. Enable only if your deployment has a network print server listening."
		},
		{
			"key": "print_server",
			"label": "Print server URL (when raw_printing=1)",
			"type": "data",
			"default": "",
			"rationale": "Required when raw_printing=1. URL of the raw-print forwarding server. Empty disables raw printing regardless of the raw_printing flag."
		},
		{
			"key": "print_server_auth",
			"label": "Print server auth (when print_server is set)",
			"type": "data",
			"default": "",
			"rationale": "Optional credentials for the raw-print server. Empty means no auth. Format depends on the server implementation (Basic, Bearer, etc.)."
		}
	]
}
