{
	"intent": "create_web_form",
	"display_name": "Create Web Form",
	"doctype": "Web Form",
	"fields": [
		{
			"key": "title",
			"label": "Web form title",
			"type": "data",
			"required": true
		},
		{
			"key": "route",
			"label": "URL route",
			"type": "data",
			"required": true
		},
		{
			"key": "doc_type",
			"label": "Target DocType",
			"type": "link",
			"link_doctype": "DocType",
			"required": true
		},
		{
			"key": "published",
			"label": "Published",
			"type": "check",
			"default": 1,
			"rationale": "When 1, the form is live at /<route>. When 0, the form exists but returns 404. Default 1 so the changeset produces a usable form; flip 0 for staging-only forms."
		},
		{
			"key": "anonymous",
			"label": "Anonymous submissions",
			"type": "check",
			"default": 0,
			"rationale": "When 1, submissions are saved under the Guest user regardless of the browser session. The submit path temporarily sets session.user to 'Guest' during save, then restores. This BYPASSES owner-based permission checks. Incompatible with login_required=1. Default 0."
		},
		{
			"key": "login_required",
			"label": "Login required",
			"type": "check",
			"default": 1,
			"rationale": "When 1, only authenticated users (portal or Desk) can see / submit the form. Default 1. Setting 0 on a form with sensitive fields leaks those fields to anonymous visitors. Cannot be combined with anonymous=1. Several UX flags only take effect when login_required=1: allow_edit, allow_multiple, allow_delete, allow_comments, allow_print, show_attachments, show_list."
		},
		{
			"key": "allow_multiple",
			"label": "Allow multiple submissions per user",
			"type": "check",
			"default": 0,
			"rationale": "Only takes effect when login_required=1. Default 0: one submission per user (subsequent visits show the existing record). Set 1 for recurring forms (timesheets, support tickets)."
		},
		{
			"key": "allow_edit",
			"label": "Allow editing own submissions",
			"type": "check",
			"default": 0,
			"rationale": "Only takes effect when login_required=1. Default 0: submissions are final once saved. Set 1 for drafts or long-running records users should revise."
		},
		{
			"key": "allow_delete",
			"label": "Allow deleting own submissions",
			"type": "check",
			"default": 0,
			"rationale": "Only takes effect when login_required=1 AND allow_multiple=1. Default 0. Enable only when users genuinely need to retract their own rows."
		},
		{
			"key": "allow_incomplete",
			"label": "Allow save with missing mandatory fields",
			"type": "check",
			"default": 0,
			"rationale": "When 1, the accept() path sets doc.flags.ignore_mandatory=True during save, allowing partial submissions. ONLY applies via the web form path - direct API submissions still enforce reqd. Default 0."
		},
		{
			"key": "apply_document_permissions",
			"label": "Apply DocType permissions",
			"type": "check",
			"default": 0,
			"rationale": "When 1, Web Form read / edit / delete respect the target DocType's DocPerm rules (not just the web form's own flags). Useful when the form is a front-end over a Desk-managed DocType. Default 0 (web-form-only access)."
		},
		{
			"key": "web_form_fields",
			"label": "Fields whitelist (list)",
			"type": "text",
			"required": true
		},
		{
			"key": "success_message",
			"label": "Success message",
			"type": "data",
			"default": "Thank you. Your submission has been recorded.",
			"rationale": "Shown on the success page when no success_url redirect is set. Keep short and confirming."
		},
		{
			"key": "success_url",
			"label": "Success redirect URL",
			"type": "data",
			"default": "",
			"rationale": "Optional. Redirect target after successful submit. Empty means the default success page (shows success_message)."
		},
		{
			"key": "button_label",
			"label": "Submit button label",
			"type": "data",
			"default": "Save",
			"rationale": "Label on the primary button. 'Save' is the Frappe default; use 'Submit' / 'Send' / 'Request' per the form's business verb."
		},
		{
			"key": "max_attachment_size",
			"label": "Max attachment size (MB)",
			"type": "int",
			"default": 0,
			"rationale": "Caps file upload size. 0 means the site-wide File Upload size limit applies."
		},
		{
			"key": "allow_comments",
			"label": "Allow comments on submissions",
			"type": "check",
			"default": 0,
			"rationale": "Only takes effect when login_required=1. Adds a comments section to submitted records for the logged-in user."
		},
		{
			"key": "introduction_text",
			"label": "Form preamble (HTML)",
			"type": "text",
			"default": "",
			"rationale": "HTML rendered ABOVE the form fields. Use for instructions, legal disclaimers, or privacy notices. Empty for bare-form layouts."
		},
		{
			"key": "show_list",
			"label": "Show list of prior submissions (login_required)",
			"type": "check",
			"default": 0,
			"rationale": "Only takes effect when login_required=1 AND allow_multiple=1. When 1, the portal shows a list view of the user's prior submissions on the form route. Empty disables the list (one-form-one-submission UX)."
		},
		{
			"key": "list_title",
			"label": "List view title (when show_list=1)",
			"type": "data",
			"default": "",
			"rationale": "Heading for the prior-submissions list. Empty falls back to the Web Form title."
		},
		{
			"key": "list_columns",
			"label": "List columns (list of {fieldname, label})",
			"type": "text",
			"default": "",
			"rationale": "Columns shown in the prior-submissions list. Each row is {fieldname, label}. Empty shows a default [name, modified] column set."
		},
		{
			"key": "show_sidebar",
			"label": "Show portal sidebar",
			"type": "check",
			"default": 0,
			"rationale": "When 1, renders a sidebar from website_sidebar alongside the form. Used on heavily branded portals. Default off (clean single-column layout)."
		},
		{
			"key": "website_sidebar",
			"label": "Sidebar definition (when show_sidebar=1)",
			"type": "link",
			"link_doctype": "Website Sidebar",
			"default": "",
			"rationale": "Names an existing Website Sidebar. Required when show_sidebar=1."
		},
		{
			"key": "breadcrumbs",
			"label": "Breadcrumbs (JSON list of {label, route})",
			"type": "text",
			"default": "",
			"rationale": "JSON list defining the breadcrumb trail shown at the top of the form page. Empty uses the default (Home -> Form Title)."
		},
		{
			"key": "success_title",
			"label": "Success page title",
			"type": "data",
			"default": "",
			"rationale": "Heading on the success page. Empty falls back to 'Thank you'. Only shown when success_url is not set."
		},
		{
			"key": "banner_image",
			"label": "Banner image (hero graphic)",
			"type": "data",
			"default": "",
			"rationale": "Optional hero image rendered at the top of the form. Attach Image path. Empty for text-only form pages."
		},
		{
			"key": "meta_title",
			"label": "SEO meta title",
			"type": "data",
			"default": "",
			"rationale": "Title tag on the form's public page. For SEO and social-share cards. Empty falls back to the Web Form title."
		},
		{
			"key": "meta_description",
			"label": "SEO meta description",
			"type": "text",
			"default": "",
			"rationale": "Meta description for search engines and social shares. Empty uses introduction_text as the fallback description."
		},
		{
			"key": "meta_image",
			"label": "SEO meta image (social card)",
			"type": "data",
			"default": "",
			"rationale": "Image used in social-share cards (og:image). Attach Image path. Empty uses the site's default meta image."
		},
		{
			"key": "custom_css",
			"label": "Custom CSS",
			"type": "text",
			"default": "",
			"rationale": "CSS scoped to the form page. Use for brand styling the default Web Form theme doesn't cover."
		},
		{
			"key": "client_script",
			"label": "Client script (JS)",
			"type": "text",
			"default": "",
			"rationale": "JavaScript executed in the public form page. Use for client-side validations, field-change handlers, payment-gateway integrations. Runs in the browser sandbox - not RestrictedPython."
		},
		{
			"key": "hide_navbar",
			"label": "Hide site navbar",
			"type": "check",
			"default": 0,
			"rationale": "When 1, the site-wide navbar is hidden on this form page. Useful for standalone / kiosk / embedded forms where site chrome distracts from the form."
		},
		{
			"key": "hide_footer",
			"label": "Hide site footer",
			"type": "check",
			"default": 0,
			"rationale": "When 1, the site-wide footer is hidden. Often paired with hide_navbar=1 for bare-page forms."
		},
		{
			"key": "allowed_embedding_domains",
			"label": "Iframe embedding allow-list",
			"type": "text",
			"default": "",
			"rationale": "One domain per line. When set, sets the Content-Security-Policy frame-ancestors header so the form can be iframe-embedded on listed domains (example.com, partner.com). Empty disallows iframe embedding entirely."
		}
	]
}
